Anderson, John Cornyn, Republican, 67.7
Andrews, John Cornyn, Republican, 81.3
Angelina, John Cornyn, Republican, 64.8
Aransas, John Cornyn, Republican, 67.3
Archer, John Cornyn, Republican, 80.3
Armstrong, John Cornyn, Republican, 84.6
Atascosa, John Cornyn, Republican, 51.6
Austin, John Cornyn, Republican, 72.8
Bailey, John Cornyn, Republican, 70.4
Bandera, John Cornyn, Republican, 73.1
Bastrop, John Cornyn, Republican, 52.6
Baylor, John Cornyn, Republican, 74.4
Bee, John Cornyn, Republican, 50.7
Bell, John Cornyn, Republican, 56.7
Bexar, Rick Noriega, Democrat, 51.6
Blanco, John Cornyn, Republican, 69.4
Borden, John Cornyn, Republican, 85
Bosque, John Cornyn, Republican, 71.6
Bowie, John Cornyn, Republican, 65.6
Brazoria, John Cornyn, Republican, 61.5
Brazos, John Cornyn, Republican, 66.3
Brewster, Rick Noriega, Democrat, 48.9
Briscoe, John Cornyn, Republican, 74.6
Brooks, Rick Noriega, Democrat, 80.5
Brown, John Cornyn, Republican, 77.5
Burleson, John Cornyn, Republican, 67
Burnet, John Cornyn, Republican, 71.3
Caldwell, John Cornyn, Republican, 51.5
Calhoun, John Cornyn, Republican, 56.3
Callahan, John Cornyn, Republican, 79
Cameron, Rick Noriega, Democrat, 64.8
Camp, John Cornyn, Republican, 60.6
Carson, John Cornyn, Republican, 83.8
Cass, John Cornyn, Republican, 65.1
Castro, John Cornyn, Republican, 68.6
Chambers, John Cornyn, Republican, 71
Cherokee, John Cornyn, Republican, 70.3
Childress, John Cornyn, Republican, 76
Clay, John Cornyn, Republican, 75.2
Cochran, John Cornyn, Republican, 72.8
Coke, John Cornyn, Republican, 81.1
Coleman, John Cornyn, Republican, 80
Collin, John Cornyn, Republican, 64.1
Collingsworth, John Cornyn, Republican, 77.1
Colorado, John Cornyn, Republican, 66.2
Comal, John Cornyn, Republican, 72.9
Comanche, John Cornyn, Republican, 68.7
Concho, John Cornyn, Republican, 75
Cooke, John Cornyn, Republican, 76.1
Coryell, John Cornyn, Republican, 64.6
Cottle, John Cornyn, Republican, 68.8
Crane, John Cornyn, Republican, 73.1
Crockett, John Cornyn, Republican, 60
Crosby, John Cornyn, Republican, 64.5
Culberson, Rick Noriega, Democrat, 60.3
Dallam, John Cornyn, Republican, 80.1
Dallas, Rick Noriega, Democrat, 54.8
Dawson, John Cornyn, Republican, 70.6
Deaf Smith, John Cornyn, Republican, 73
Delta, John Cornyn, Republican, 66.2
Denton, John Cornyn, Republican, 63
DeWitt, John Cornyn, Republican, 73.4
Dickens, John Cornyn, Republican, 76.6
Dimmit, Rick Noriega, Democrat, 76.9
Donley, John Cornyn, Republican, 80.9
Duval, Rick Noriega, Democrat, 79.7
Eastland, John Cornyn, Republican, 76.1
Ector, John Cornyn, Republican, 72.1
Edwards, John Cornyn, Republican, 66.4
Ellis, John Cornyn, Republican, 68.1
El Paso, Rick Noriega, Democrat, 65.8
Erath, John Cornyn, Republican, 74.8
Falls, John Cornyn, Republican, 59.7
Fannin, John Cornyn, Republican, 63.8
Fayette, John Cornyn, Republican, 69.6
Fisher, John Cornyn, Republican, 59.4
Floyd, John Cornyn, Republican, 71.4
Foard, John Cornyn, Republican, 56.7
Fort Bend, John Cornyn, Republican, 50.9
Franklin, John Cornyn, Republican, 75.8
Freestone, John Cornyn, Republican, 67.5
Frio, Rick Noriega, Democrat, 60.4
Gaines, John Cornyn, Republican, 81.6
Galveston, John Cornyn, Republican, 55.8
Garza, John Cornyn, Republican, 74.3
Gillespie, John Cornyn, Republican, 78.7
Glasscock, John Cornyn, Republican, 89.6
Goliad, John Cornyn, Republican, 61.8
Gonzales, John Cornyn, Republican, 62.3
Gray, John Cornyn, Republican, 84.4
Grayson, John Cornyn, Republican, 67.8
Gregg, John Cornyn, Republican, 69.5
Grimes, John Cornyn, Republican, 63.8
Guadalupe, John Cornyn, Republican, 64.4
Hale, John Cornyn, Republican, 71.1
Hall, John Cornyn, Republican, 70.8
Hamilton, John Cornyn, Republican, 72.5
Hansford, John Cornyn, Republican, 88.4
Hardeman, John Cornyn, Republican, 72
Hardin, John Cornyn, Republican, 76.8
Harris, Rick Noriega, Democrat, 50.7
Harrison, John Cornyn, Republican, 64.9
Hartley, John Cornyn, Republican, 86.3
Haskell, John Cornyn, Republican, 63.7
Hays, John Cornyn, Republican, 51.8
Hemphill, John Cornyn, Republican, 84.3
Henderson, John Cornyn, Republican, 68.8
Hidalgo, Rick Noriega, Democrat, 70
Hill, John Cornyn, Republican, 66.5
Hockley, John Cornyn, Republican, 76.9
Hood, John Cornyn, Republican, 74.1
Hopkins, John Cornyn, Republican, 66.9
Houston, John Cornyn, Republican, 66.2
Howard, John Cornyn, Republican, 69.5
Hudspeth, Rick Noriega, Democrat, 47.5
Hunt, John Cornyn, Republican, 68
Hutchinson, John Cornyn, Republican, 83.9
Irion, John Cornyn, Republican, 78.6
Jack, John Cornyn, Republican, 79
Jackson, John Cornyn, Republican, 71
Jasper, John Cornyn, Republican, 66.1
Jeff Davis, John Cornyn, Republican, 55.1
Jefferson, Rick Noriega, Democrat, 51.1
Jim Hogg, Rick Noriega, Democrat, 81.6
Jim Wells, Rick Noriega, Democrat, 61.4
Johnson, John Cornyn, Republican, 69.7
Jones, John Cornyn, Republican, 70.9
Karnes, John Cornyn, Republican, 58.8
Kaufman, John Cornyn, Republican, 64.9
Kendall, John Cornyn, Republican, 77.6
Kenedy, Rick Noriega, Democrat, 52.6
Kent, John Cornyn, Republican, 74.9
Kerr, John Cornyn, Republican, 73.2
Kimble, John Cornyn, Republican, 79.6
King, John Cornyn, Republican, 91
Kinney, John Cornyn, Republican, 57.8
Kleberg, Rick Noriega, Democrat, 57.4
Knox, John Cornyn, Republican, 69.1
Lamar, John Cornyn, Republican, 64.6
Lamb, John Cornyn, Republican, 74.2
Lampasas, John Cornyn, Republican, 74.5
La Salle, Rick Noriega, Democrat, 63
Lavaca, John Cornyn, Republican, 72.6
Lee, John Cornyn, Republican, 67.3
Leon, John Cornyn, Republican, 77
Liberty, John Cornyn, Republican, 65.8
Limestone, John Cornyn, Republican, 64.4
Lipscomb, John Cornyn, Republican, 86.2
Live Oak, John Cornyn, Republican, 70.4
Llano, John Cornyn, Republican, 75.1
Loving, John Cornyn, Republican, 75.3
Lubbock, John Cornyn, Republican, 70.3
Lynn, John Cornyn, Republican, 70.9
McCulloch, John Cornyn, Republican, 74.9
McLennan, John Cornyn, Republican, 62.4
McMullen, John Cornyn, Republican, 73.7
Madison, John Cornyn, Republican, 67.3
Marion, John Cornyn, Republican, 59.4
Martin, John Cornyn, Republican, 76.7
Mason, John Cornyn, Republican, 74.6
Matagorda, John Cornyn, Republican, 59
Maverick, Rick Noriega, Democrat, 79.1
Medina, John Cornyn, Republican, 65.1
Menard, John Cornyn, Republican, 71.9
Midland, John Cornyn, Republican, 78.1
Milam, John Cornyn, Republican, 61
Mills, John Cornyn, Republican, 77.1
Mitchell, John Cornyn, Republican, 70.8
Montague, John Cornyn, Republican, 74.4
Montgomery, John Cornyn, Republican, 74.4
Moore, John Cornyn, Republican, 78.1
Morris, John Cornyn, Republican, 56.6
Motley, John Cornyn, Republican, 85.8
Nacogdoches, John Cornyn, Republican, 63.7
Navarro, John Cornyn, Republican, 62.8
Newton, John Cornyn, Republican, 58.3
Nolan, John Cornyn, Republican, 68
Nueces, Rick Noriega, Democrat, 48.7
Ochiltree, John Cornyn, Republican, 90.8
Oldham, John Cornyn, Republican, 87.5
Orange, John Cornyn, Republican, 68.5
Palo Pinto, John Cornyn, Republican, 69.3
Panola, John Cornyn, Republican, 71.8
Parker, John Cornyn, Republican, 74.4
Parmer, John Cornyn, Republican, 80
Pecos, John Cornyn, Republican, 59.1
Polk, John Cornyn, Republican, 63.7
Potter, John Cornyn, Republican, 69.2
Presidio, Rick Noriega, Democrat, 73.1
Rains, John Cornyn, Republican, 68.2
Randall, John Cornyn, Republican, 81.1
Reagan, John Cornyn, Republican, 79.1
Real, John Cornyn, Republican, 75.2
Red River, John Cornyn, Republican, 62.2
Reeves, Rick Noriega, Democrat, 57.1
Refugio, John Cornyn, Republican, 53.7
Roberts, John Cornyn, Republican, 92.5
Robertson, John Cornyn, Republican, 57.3
Rockwall, John Cornyn, Republican, 72.4
Runnels, John Cornyn, Republican, 79.4
Rusk, John Cornyn, Republican, 72.4
Sabine, John Cornyn, Republican, 70.4
San Augustine, John Cornyn, Republican, 60.2
San Jacinto, John Cornyn, Republican, 62
San Patricio, John Cornyn, Republican, 54.3
San Saba, John Cornyn, Republican, 78.4
Schleicher, John Cornyn, Republican, 68.8
Scurry, John Cornyn, Republican, 77.7
Shackelford, John Cornyn, Republican, 84.2
Shelby, John Cornyn, Republican, 69.3
Sherman, John Cornyn, Republican, 85.9
Smith, John Cornyn, Republican, 69.4
Somervell, John Cornyn, Republican, 70.8
Starr, Rick Noriega, Democrat, 85.8
Stephens, John Cornyn, Republican, 77.6
Sterling, John Cornyn, Republican, 83.7
Stonewall, John Cornyn, Republican, 67.4
Sutton, John Cornyn, Republican, 71.6
Swisher, John Cornyn, Republican, 63.4
Tarrant, John Cornyn, Republican, 55.3
Taylor, John Cornyn, Republican, 73.3
Terrell, John Cornyn, Republican, 58.7
Terry, John Cornyn, Republican, 69.2
Throckmorton, John Cornyn, Republican, 77.7
Titus, John Cornyn, Republican, 61.9
Tom Green, John Cornyn, Republican, 71.3
Travis, Rick Noriega, Democrat, 58.6
Trinity, John Cornyn, Republican, 61.8
Tyler, John Cornyn, Republican, 66.7
Upshur, John Cornyn, Republican, 71.7
Upton, John Cornyn, Republican, 74.8
Uvalde, Rick Noriega, Democrat, 49.6
Val Verde, Rick Noriega, Democrat, 56.6
Van Zandt, John Cornyn, Republican, 72.8
Victoria, John Cornyn, Republican, 67
Walker, John Cornyn, Republican, 58.9
Waller, John Cornyn, Republican, 52
Ward, John Cornyn, Republican, 70.7
Washington, John Cornyn, Republican, 70
Webb, Rick Noriega, Democrat, 77.7
Wharton, John Cornyn, Republican, 61.5
Wheeler, John Cornyn, Republican, 83.4
Wichita, John Cornyn, Republican, 68.4
Wilbarger, John Cornyn, Republican, 70.5
Willacy, Rick Noriega, Democrat, 69.1
Williamson, John Cornyn, Republican, 58.6
Wilson, John Cornyn, Republican, 64.6
Winkler, John Cornyn, Republican, 73.8
Wise, John Cornyn, Republican, 73.5
Wood, John Cornyn, Republican, 75.7
Yoakum, John Cornyn, Republican, 78.5
Young, John Cornyn, Republican, 78.7
Zapata, Rick Noriega, Democrat, 76
Zavala, Rick Noriega, Democrat, 84.7